title,url,content
"Giants win big to end skid, lose grip on No. 1 pick",https://www.espn.com/nfl/story/_/id/43214740/giants-end-10-game-skid-lose-grip-no-1-pick-nfl-draft,"EAST RUTHERFORD, N.J. -- Even when the New York Giants win these days, it comes at a cost.
The Giants fell out of pole position for the No. 1 overall pick in the 2025 NFL draft with a 45-33 win over… [+3289 chars]"
Will MetLife Benefit In 2025?,https://www.forbes.com/sites/greatspeculations/2025/01/03/will-metlife-benefit-in-2025/,"NEW YORK, NY - MAY 14: The MetLife corporate logo sits at the top of their building on Park Avenue ... [+] seen from the new SummitOV observation deck under construction at One Vanderbilt on May 14, … [+2593 chars]"
MetLife denies hack after ransomware group claims attack,https://www.techradar.com/pro/security/metlife-denies-hack-after-ransomware-group-claims-attack,<ul><li>RansomHub claims intrusion into what appears to be MetLife’s Latin-American division</li><li>Group leaks MetLife documents to corroborate the claim</li><li>However MetLife says the intrusion … [+1553 chars]
Rodgers accepts Sunday could be final NFL game,https://www.espn.com/nfl/story/_/id/43251710/jets-aaron-rodgers-acknowledges-sunday-last-nfl-game,"FLORHAM PARK, N.J. -- New York Jets quarterback Aaron Rodgers will make his 241st career start Sunday. It could be his last.
""Yeah, of course,"" he said Wednesday, acknowledging the thought is on his… [+4242 chars]"
Nick Nadgauda Joins MetLife As Chief Information Officer,https://www.forbes.com/sites/peterhigh/2025/01/10/nick-nadgauda-joins-metlife-as-chief-information-officer/,"MetLife headquarters in New York
LightRocket via Getty Images
MetLife, Inc. announced that Nick Nadgauda has been named Executive Vice President and Chief Information Officer, effective March 10, 2… [+2809 chars]"
MetLife to acquire PineBridge Investments for $800M,https://finance.yahoo.com/news/metlife-acquire-pinebridge-investments-800m-135532580.html,"https://www.tipranks.com/news/the-fly/metlife-to-acquire-pinebridge-investments-for-800m
MetLife (MET) Investment Management, the institutional asset management business of MetLife, announced that i… [+800 chars]"
Notre Dame AD: Irish Committed to Independent Status amid Run to CFP Title Game,https://bleacherreport.com/articles/10150446-notre-dame-ad-irish-committed-to-independent-status-amid-run-to-cfp-title-game,"Michael Reaves/Getty Images
Notre Dame athletic director Pete Bevacqua defended the Fighting Irish's status as an independent on Friday.
""No secret, the expansion of the CFP from four to 12 teams h… [+2192 chars]"
"NFL Playoffs 2025: Eagles vs. Rams Weather Forecast, Projected Snow Total for Matchup",https://bleacherreport.com/articles/10151266-nfl-playoffs-2025-eagles-vs-rams-weather-forecast-projected-snow-total-for-matchup,"Mitchell Leff/Getty Images
The Philadelphia Eagles and Los Angeles Rams could be set for a snowy divisional round matchup this weekend.
Parts of the Philadelphia area are forecast to get between th… [+2509 chars]"
"Malik Nabers, Drew Lock shine in Giants' 45-33 win over Colts",https://consent.yahoo.com/v2/collectConsent?sessionId=1_cc-session_e89c6e1c-7b11-4f47-ac35-05a250b068a9,"If you click 'Accept all', we and our partners, including 238 who are part of the IAB Transparency &amp; Consent Framework, will also store and/or access information on a device (in other words, use … [+678 chars]"
"Tyler Higbee: ""Special"" to catch game-winning TD in return from knee injury",https://www.nbcsports.com/nfl/profootballtalk/rumor-mill/news/tyler-higbee-special-to-catch-game-winning-td-in-return-from-knee-injury,"Rams tight end Tyler Higbees long road back from tearing his ACL, MCL and meniscus ended at MetLife Stadium on Sunday and Higbee showed why the Rams were happy to have him back in the fourth quarter.… [+996 chars]"
Giants' Nabers practices; Tracy cleared to play,https://www.espn.com/nfl/story/_/id/43184116/giants-malik-nabers-practices-tyrone-tracy-cleared-play,"EAST RUTHERFORD, N.J. -- New York Giants rookie wide receiver Malik Nabers and running back Tyrone Tracy Jr. practiced Friday for the first time this week, and there seems to be a good chance both ar… [+1955 chars]"
US insurer MetLife acquires PineBridge Investments in up to $1.2 billion deal,https://finance.yahoo.com/news/us-insurer-metlife-acquires-pinebridge-134614675.html,"(Reuters) -MetLife Investment Management, a subsidiary of U.S. insurer MetLife said on Monday it has agreed to buy PineBridge Investments, a global asset manager, from Pacific Century Group in a deal… [+629 chars]"
Weather to keep planes carrying protest banners away from Giants' home finale at MetLife Stadium,https://sports.yahoo.com/weather-to-keep-planes-carrying-protest-banners-away-from-giants-home-finale-at-metlife-stadium-174854510.html,"The skies above MetLife Stadium may feature clouds and rain for Sunday's New York Giants home finale against the Indianapolis Colts they won't, however, see any planes flying overhead carrying protes… [+1515 chars]"
WWE Rumors on 2-Night Money in the Bank; MJF in Happy Gilmore 2; NXT Stars Engaged,https://bleacherreport.com/articles/10148667-wwe-rumors-on-2-night-money-in-the-bank-mjf-in-happy-gilmore-2-nxt-stars-engaged,"WWE/Getty Images
Bleacher Report catches you up on the latest news from the WWE Universe and All Elite Wrestling.
WWE Reportedly Considering 2-Night Money in the Bank Events
WWE is reportedly look… [+4546 chars]"
Personalizing Benefits For A Four-Generation Workplace,https://www.forbes.com/councils/forbesbusinesscouncil/2024/12/26/personalizing-benefits-for-a-four-generation-workplace/,"Tim Pratte, CEO of Selerix.
getty
How can organizations design benefits that meet the diverse needs of a four-generation workforce while also ensuring employees engage with the right options at the… [+6868 chars]"
"Gen-Zs Are Stressed, Burned Out And Face Mental Health Issues",https://www.forbes.com/sites/jackkelly/2025/01/07/gen-zs-are-stressed-burned-out-and-face-mental-health-issues/,"Gen Zers are experiencing unprecedented levels of stress and anxiety.
getty
Projected to comprise nearly 30% of the labor force in 2025, Gen Z is filling the void left by retiring Baby Boomers. Thi… [+4643 chars]"
"FC Barcelona Agrees To Let Player Change Club, Reports MARCA",https://www.forbes.com/sites/tomsanderson/2025/01/16/fc-barcelona-agrees-to-let-player-change-club-reports-marca/,"FC Barcelona has given the green light to one of its players changing clubs mid-season according to ... [+] MARCA, which cited anonymous sources.
UEFA via Getty Images
FC Barcelona has given the gr… [+2008 chars]"
How high is metlife stadium?,https://lifesciencesworld.com/how-high-is-metlife-stadium/,"How High is MetLife Stadium?
MetLife Stadium is a multi-purpose stadium located in East Rutherford, New Jersey, United States. It is the home stadium of the New York Jets and the New York Giants of … [+5046 chars]"
"Jets WR Garrett Wilson wants more targets, but says 'people see it differently'",https://www.espn.com/nfl/story/_/id/43116134/new-york-jets-garrett-wilson-aaron-rodgers-week-16-loss,"EAST RUTHERFORD, N.J. -- The weather wasn't the only thing frigid on Sunday at MetLife Stadium. So was the on-field relationship between New York Jets quarterback Aaron Rodgers and wide receiver Garr… [+3251 chars]"
2025 sports calendar: 50 bucket list events you can't miss next year,https://www.foxsports.com/stories/soccer/2025-sports-calendar-50-bucket-list-events-you-cant-miss-next-year,"The start of the new year brings another opportunity to attend some of the biggest and most historic sporting events from all over the world.
This past year was filled with once-in-a-lifetime experi… [+3980 chars]"
MetLife to Buy Li’s PineBridge in Asset Management Push,https://consent.yahoo.com/v2/collectConsent?sessionId=1_cc-session_fcca11e9-7eb2-49f6-8393-6a8715dcb3b6,"If you click 'Accept all', we and our partners, including 238 who are part of the IAB Transparency &amp; Consent Framework, will also store and/or access information on a device (in other words, use … [+678 chars]"
MetLife signs deal to acquire asset manager PineBridge,https://www.privatebankerinternational.com/news/metlife-asset-pinebridge/,"MetLife Investment Management (MIM), the institutional asset management business of US insurance giant MetLife, has agreed to acquire asset management firm PineBridge Investments from Pacific Century… [+2460 chars]"
El trofeo del Mundial de Clubes inicia su tour en Nueva York,https://www.marca.com/futbol/mundial-de-clubes/2025/01/17/trofeo-mundial-clubes-inicia-tour-nueva-york.html,El Tour del Trofeo del Mundial de Clubes FIFA arrancó ayer por la noche en un exclusivo evento en la flagship store de Tiffany &amp; Co. de la Quinta Avenida de Nueva York. Este tour marca el comienz… [+3194 chars]
"Giants, Jets experience steep drop in local viewership",https://www.nbcsports.com/nfl/profootballtalk/rumor-mill/news/giants-jets-experience-steep-drop-in-local-viewership,"The Jets and Giants stink this year. And their fans arent taking in the aroma.
Via John Ourand of Puck, the Jets local viewership is down 29 percent over last year. For the Giants, the drop is 30 pe… [+601 chars]"
Jets accidentally bring team banner out upside down in pregame display,https://www.cbssports.com/nfl/news/jets-accidentally-bring-team-banner-out-upside-down-in-pregame-display/,"The New York Jets' 2024 season came to a merciful end on Sunday at MetLife Stadium, as the team managed to preserve its dignity with a 32-20 victory over the AFC East rival Miami Dolphins. That win, … [+1012 chars]"
Meet the billionaire owners of every NFL team,https://www.businessinsider.com/nfl-team-owners,"Jerry Jones has owned the Dallas Cowboys since 1989.Todd Kirkland/Contributor/Getty Images
<ul><li>The NFL is one of the biggest businesses in the world.</li><li>Jerry Jones' Dallas Cowboys are the … [+37570 chars]"
メットライフ・インベスト・マネジメント、パインブリッジを買収,https://prtimes.jp/main/html/rd/p/000000525.000005541.html,"MetLife, Inc.20241223
20241223MIM 1,000 8202522
New FrontierMIMMIM7,000
CEOAMIM
CFOMIMJohn McCallionMIMMIM
MIM31
MIM
Greg EhretCEOMIM
1996AIG2010
2025BofA SecuritiesMIMA&amp;O ShearmanJ.P. M… [+38 chars]"
"How to Watch Dolphins vs Jets: Live Stream NFL, TV Channel",https://www.newsweek.com/sports/nfl/how-watch-dolphins-vs-jets-live-stream-nfl-tv-channel-2009977,The Miami Dolphins (8-8) head to MetLife Stadium on Sunday to face the New York Jets (4-12) in a Week 18 regular-season finale with very different stakes for each team. Kickoff is set for 4:25 p.m. E… [+1785 chars]
"Giants will retain Brian Daboll, Joe Schoen for 2025 season",https://www.nbcsports.com/nfl/profootballtalk/rumor-mill/news/giants-will-retain-brian-daboll-joe-schoen-for-2025-season,The person who hired planes to tow banners urging Giants owner John Mara to fire everyone involved in putting together a Giants team that went 3-14 this season is going to be very disappointed on Mon… [+1202 chars]
Darius Slayton: Another year for Brian Daboll is warranted,https://www.nbcsports.com/nfl/profootballtalk/rumor-mill/news/darius-slayton-another-year-for-brian-daboll-is-warranted,"One of the questions to be answered after Week 18 is if it will be Brian Dabolls final game as the Giants head coach. 
Daboll took the Giants to the playoffs and won a game in his first season, but … [+896 chars]"
John Mara: I've just about run out of patience,https://www.nbcsports.com/nfl/profootballtalk/rumor-mill/news/john-mara-ive-just-about-run-out-of-patience,"Giants co-owner John Mara held a press conference on Monday and offered a blunt assessment of the teams 2024 season. 
Mara said the Giants stunk, which made his decision to stick with the architects… [+1090 chars]"
New York Giants players insist they're still playing for something,https://www.espn.com/nfl/story/_/id/43124699/new-york-giants-players-insist-playing-week-17,ATLANTA -- The New York Giants are getting blown off the field on almost a weekly basis. The past two weeks alone they've lost by a combined 48 points to the Baltimore Ravens and Atlanta Falcons. The… [+5036 chars]
"Hill sits in 4th quarter, hints at leaving Miami",https://www.espn.com/nfl/story/_/id/43303355/hill-hints-potential-exit-miami-dolphins-loss,"EAST RUTHERFORD, N.J. -- Miami Dolphins wide receiver Tyreek Hill hinted at a potential exit from the team following a season-ending loss Sunday to the New York Jets, during which he did not play in … [+4718 chars]"
"마인드풀커넥트, 엠와이소셜컴퍼니와 업무협약 체결",https://www.venturesquare.net/955147,"(MYSC) ‘ ’ (MOU) , SEED . , .
 , . , .
 MYSC . MYSC ‘ 7.0’ , , . , , .
 MOU SEED , . MYSC , , .
 , MYSC , .
Mindful Connect Signs Business Agreement with MY Social Company 
Mindful Connect anno… [+5171 chars]"
Telemetry data from 800K VW Group EVs exposed online,https://www.theregister.com/2025/01/06/volkswagen_ev_data_exposed/,"Infosec in Brief Welcome to 2025: hopefully you enjoyed a pleasant holiday season and returned to the security operations center without incident - unlike Volkswagen, which last week admitted it expo… [+7248 chars]"
Mike McDaniel suggests Tyreek Hill removed himself from Sunday's game,https://www.nbcsports.com/nfl/profootballtalk/rumor-mill/news/mike-mcdaniel-suggests-tyreek-hill-removed-himself-from-sundays-game,"It wasnt nearly as dramatic as the last time a high-profile receiver refused to play in a game against the Jets at MetLife Stadium, nearly three years ago to the day. It might lead to the same result… [+1535 chars]"
"Estreia 'salgada': ingressos para jogos de brasileiros no Super Mundial podem custar mais de R$ 8,5 mil","https://www.terra.com.br/esportes/futebol/internacional/estreia-salgada-ingressos-para-jogos-de-brasileiros-no-super-mundial-podem-custar-mais-de-r-85-mil,d3f13d55599ef0e62a73a303f4e74c6bximzanw9.html","Já estão disponíveis os ingressos para os jogos do Mundial de Clubes da Fifa de 2025, torneio que, a partir deste ano, será realizado a cada quatro anos e terá nada menos que 32 equipes na disputa. C… [+2397 chars]"
Sam Darnold’s playoff debut gets off to disastrous start with two Vikings turnovers,https://nypost.com/2025/01/13/sports/sam-darnolds-vikings-playoff-debut-off-to-disastrous-start/,"Maybe the ghosts of MetLife traveled to State Farm Stadium.
Sam Darnolds first half of playoff football quickly turned disastrous, with the Vikings quarterback and Jets castoff turning the ball over… [+1055 chars]"
"Heroes, zeros from Jets’ win over Dolphins: Garrett Wilson captures a career-first",https://nypost.com/2025/01/06/sports/heroes-zeros-from-jets-win-over-dolphins-garrett-wilson-captures-a-career-first/,"Heroes, zeros from the Jets’ 32-20 win over the Dolphins at MetLife Stadium on Sunday:
Aaron Rodgers threw for a season-high four touchdown passes to surpass 500 (503) for his career in what could h… [+550 chars]"
,https://www.uol.com.br/esporte/futebol/ultimas-noticias/2025/01/08/super-mundial-preco-ingressos-estreias-brasileiros.htm,"O ingresso para a estreia do Palmeiras diante do Porto, no MetLife Stadium, fica entre R$ 609 (US$ 100) e R$ 7,35 mil ( US$ 1.210). Resta poucas opções de assentos ainda livres nos melhores setores d… [+1208 chars]"
Fireman Ed reignites Jets beef with claim team kept off jumbotron for consecutive home games,https://nypost.com/2024/12/22/sports/fireman-ed-reignites-jets-beef-with-jumbotron-freeze-out-claim/,"Fireman Ed once again claimed the Jets were trying to hide his presence at MetLife Stadium. 
After the Jets’ 19-9 loss to the Rams, the franchise’s famed fan claimed in a post on social media that h… [+1866 chars]"
"Jets vs. Bills: Preview, prediction, what to watch for",https://nypost.com/2025/01/05/sports/jets-vs-bills-preview-prediction-what-to-watch-for-4/,"An inside look at the Jets-Dolphins Week 18 matchup on Sunday at MetLife Stadium: 
Dolphins QB Tyler Snoop Huntley vs. the Jets defense
The Bills embarrassed the Jets defense last week, hanging 40 … [+4066 chars]"
Why Giants will avoid another plane humiliation before Week 17 home finale,https://nypost.com/2024/12/27/sports/why-giants-will-avoid-another-plane-humiliation-before-week-17-home-finale/,"It wont be a banner day for the Giants at MetLife Stadium.
Or maybe it will be, in a different sense of the term.
High Exposure Aerial Advertising has cancelled orders for three banner-carrying pla… [+1957 chars]"
Giants Week 17 report card: Where has this offense been all season?,https://nypost.com/2024/12/29/sports/giants-week-17-report-card-where-has-this-offense-been-all-season/,"Grading the Giants’ 45-33 win over the Colts at MetLife Stadium on Sunday:
Where the hell has this been all season? 
The numbers across the board were remarkable. 
There were 446 total yards, 25 f… [+3391 chars]"
Eli Manning Makes Super Bowl LIX Prediction — And It Doesn’t Involve The Kansas City Chiefs,https://www.forbes.com/sites/djsiddiqi/2025/01/06/eli-manning-makes-super-bowl-lix-prediction---and-it-doesnt-involve-the-kansas-city-chiefs/,"New York Giants legend Eli Manning predicts it'll be the Detroit Lions against the Buffalo Bills in ... [+] Super Bowl LIX. (Photo by Kevin Sabitus/Getty Images)
Getty Images
New York Giants great … [+5314 chars]"
Verizon Super Bowl 59 FanFest Turns Empty NFL Stadiums Into Tailgate Parties,https://www.adweek.com/convergent-tv/verizon-super-bowl-59-fanfest/,"Just because the Super Bowl only has use for one of the National Football Leagues 30 stadiums doesnt mean league sponsor Verizon has to limit its Big Game party to one venue.
After helping Beyoncé d… [+2257 chars]"
"Giants Rumors: Fan Protests 'Have Not Impacted' Mara's Decisions on Daboll, Schoen",https://bleacherreport.com/articles/10149561-giants-rumors-fan-protests-have-not-impacted-maras-decisions-on-daboll-schoen,"Ed Mulholland/Getty Images
New York Giants owner John Mara's decisions regarding the future of head coach Brian Daboll and general manager Joe Schoen haven't been influenced by protests from fans, a… [+1192 chars]"
Aaron Rodgers on when Jets’ season took permanent turn for worse,https://nypost.com/2025/01/05/sports/aaron-rodgers-on-when-jets-season-took-permanent-turn-for-worse/,"The Jets will return to MetLife Stadium for the last time this season on Sunday to face the Dolphins.
It feels like three years ago, but it was just a little over three months ago when the Jets woul… [+2449 chars]"
Jets close out season with 32-20 win over Dolphins,https://www.nbcsports.com/nfl/profootballtalk/rumor-mill/news/jets-close-out-season-with-32-20-win-over-dolphins,"Sundays regular season finale looked a lot like the games the Jets were imagining when they traded for quarterback Aaron Rodgers. 
Rodgers threw for 274 yards and four touchdowns to lead the Jets to… [+1985 chars]"
PNB MetLife partners with Saraswat Co-operative Bank to offer insurance solutions,https://www.thehindubusinessline.com/money-and-banking/pnb-metlife-partners-with-saraswat-co-operative-bank-to-offer-insurance-solutions/article69103904.ece,"PNB MetLife India Insurance Company Ltd (PNB MetLife) has forged a strategic bancassurance partnership with Saraswat Co-operative Bank Ltd, one of the largest urban co-operative banks in India.
This… [+1966 chars]"
"NFL Week 16 weather: Frigid temperatures expected for Lions at Bears, Browns at Bengals, Patriots at Bills",https://www.cbssports.com/nfl/news/nfl-week-16-weather-frigid-temperatures-expected-for-lions-at-bears-browns-at-bengals-patriots-at-bills/,"Jack Frost is set to make his presence felt in the NFL in Week 16, nipping at players' helmets in what is expected to be frigid temperatures in a handful of games. Specifically, Cincinnati, Buffalo a… [+1565 chars]"
"Gen Z already suffering ‘midlife crisis,’ research finds: ‘Not doing well’",https://nypost.com/2025/01/16/lifestyle/gen-z-already-suffering-midlife-crisis-research-finds-not-doing-well/,"It’s not exactly working for Gen Z. 
Zoomer employees are struggling in just about every metric, according to a new MetLife study that examines the physical, social, mental and financial wellbeing o… [+2986 chars]"
Colts Make Final Decision on Anthony Richardson For Season Finale vs Jaguars,https://www.newsweek.com/sports/nfl/colts-make-final-decision-anthony-richardson-season-finale-vs-jaguars-2009442,"Joe Flacco will be getting a second straight start for the Indianapolis Colts in their season finale against the Jacksonville Jaguars on Sunday.
Anthony Richardson has been ruled out because of an o… [+1440 chars]"
Jets' Davante Adams and Giants' Malik Nabers Among NFL Week 17 Actives/Inactives,https://www.newsweek.com/sports/nfl/jets-davante-adams-giants-malik-nabers-among-nfl-week-17-actives-inactives-2007142,"Several top wide receivers were announced as active for Week 17 action on Sunday morning.
New York Jets Davante Adams, New York Giants Malik Nabers and New Orleans Saints Marquez Valdes-Scantling ar… [+1554 chars]"
,https://www.uol.com.br/esporte/futebol/ultimas-noticias/2024/12/27/mundial-arte-tem-vini-em-destaque-botafogo-com-moral-e-neymar-de-fora.htm,"O início está marcado para o dia 15 de junho, e a final ocorre no dia 13 de julho. O calendário brasileiro será paralisado durante a competição.
Os EUA sediarão o Super Mundial em 12 estádios difere… [+568 chars]"
Weather to keep planes carrying protest banners away from Giants' home finale at MetLife Stadium,https://consent.yahoo.com/v2/collectConsent?sessionId=1_cc-session_6cc486a8-0e4d-45f9-a1cc-c804f4515c44,"If you click 'Accept all', we and our partners, including 238 who are part of the IAB Transparency &amp; Consent Framework, will also store and/or access information on a device (in other words, use … [+678 chars]"
How Beyoncé’s Reinventions Are Redefining Global Travel and Tourism,https://www.forbes.com/sites/ashleemariepreston/2025/01/03/how-beyoncs-reinventions-are-redefining-global-travel-and-tourism/,"DUBAI, UNITED ARAB EMIRATES - JANUARY 21: Beyoncé attends the Atlantis The Royal Grand Reveal ... [+] Weekend, a new ultra-luxury resort on January 21, 2023 in Dubai, United Arab Emirates. (Photo by … [+7232 chars]"
Want The Ultimate NFL Experience? Take The Leap To Lambeau,https://www.forbes.com/sites/chrisdorsey/2024/12/26/want-the-ultimate-nfl-experience-take-the-leap-to-lambeau/,"GREEN BAY, WISCONSIN - DECEMBER 23: A general view outside of Lambeau Field before the game between ... [+] the New Orleans Saints and the Green Bay Packers on December 23, 2024 in Green Bay, Wiscons… [+7477 chars]"
Why The “Money Lost” For Sam Darnold These Past Two Weeks Is Overblown,https://www.forbes.com/sites/tylersmall/2025/01/15/why-the-lost-money-for-sam-darnold-is-overblown/,"EAST RUTHERFORD, NEW JERSEY - SEPTEMBER 08: Sam Darnold #14 of the Minnesota Vikings reacts after ... [+] defeating the New York Giants at MetLife Stadium on September 08, 2024 in East Rutherford, Ne… [+5991 chars]"
Torcedor pode gastar até R$ 9 mil em ingressos para ver Palmeiras no Super Mundial,https://www.infomoney.com.br/consumo/torcedor-pode-gastar-ate-r-9-mil-em-ingressos-para-ver-palmeiras-no-super-mundial/,"A Fifa abriu nesta quinta-feira as vendas de ingressos para a fase de mata-mata do Mundial de Clubes. Com isso, o torcedor do Palmeiras que pretende acompanhar os jogos do clube nos Estados Unidos co… [+2407 chars]"
Pat McAfee goes on wild tirade as war with Colts escalates after pitiful loss to Giants,https://nypost.com/2024/12/30/sports/pat-mcafee-goes-on-wild-tirade-as-war-with-colts-escalates/,"Pat McAfee has been highly critical of the Indianapolis Colts this season, and that hit a boiling point on Sunday when “everything went.. just like I fking said it would,” the ESPN host wrote in a fu… [+4037 chars]"
The Jets Inadvertently Cued Up The Perfect Song At The Exact Moment Tyreek Hill Quit On The Dolphins,https://brobible.com/sports/article/tyreek-hill-quit-dolphins-curb-your-enthusiasm-theme/,"Getty Image
It appears there’s a good chance Tyreek Hill has played his last snap in a Dolphins uniform based on what he had to say after prematurely exiting the team’s season finale against the Jet… [+2175 chars]"
"Giants vs. Colts where to watch: TV channel, NFL kickoff time, live stream, spread, odds",https://www.cbssports.com/nfl/news/giants-vs-colts-where-to-watch-tv-channel-nfl-kickoff-time-live-stream-spread-odds/,"The Indianapolis Colts need a win in Week 17 just to keep their faint playoff hopes alive. The good news for them is that they get the New York Giants, the last-place team in the NFL.
The Colts come… [+1828 chars]"
New York Giants Might Retain Brian Daboll or Joe Schoen: Report,https://www.newsweek.com/sports/nfl/new-york-giants-might-retain-brian-daboll-joe-schoen-report-2009912,"The New York Giants have been a mess in 2024, so much so, that fans were willing to pay for signs to fly around MetLife Stadium. These signs called for team owner John Mara to ""fix the franchise.""
R… [+4402 chars]"
"How to Watch Giants vs Eagles: Live Stream NFL, TV Channel",https://www.newsweek.com/sports/nfl/how-watch-giants-vs-eagles-live-stream-nfl-tv-channel-2009853,"The New York Giants (3-13) and Philadelphia Eagles (13-3) are set to close out their regular seasons on Sunday at Lincoln Financial Field in Philadelphia. Kickoff is scheduled for 1 p.m. ET on CBS, a… [+1794 chars]"
Aaron Rodgers Casually Reveals Major Relationship Update,https://www.newsweek.com/entertainment/celebrity-news/aaron-rodgers-major-relationship-update-2005828,"Entertainment gossip and news from Newsweek's network of contributors
Love is in the air this holiday season, and Aaron Rodgers is surely feeling it.
During an appearance on an episode of The Pat M… [+1979 chars]"
