title,url,content
MetLife Investment Management to Acquire PineBridge Investments,https://www.investing.com/news/press-releases/metlife-investment-management-to-acquire-pinebridge-investments-93CH-3786880,"Acquisition of Leading Global Asset Manager
Accelerates Growth of MetLife (NYSE:MET) Investment Management
Strong Strategic and Cultural Fits and Attractive Financially
 WHIPPANY, N.J.--(BUSINESS … [+7038 chars]"
Incrementar la penetración de seguros: El reto para el sector en 2025,https://www.excelsior.com.mx/nacional/incrementar-seguros-reto-2025/1695449,"A nivel mundial, el sector asegurador se encuentra en una etapa de profunda transformación, en particular, con cambios demográficos como el envejecimiento de la población y la expansión de la clase m… [+4008 chars]"
Τα μεγάλα αθλητικά ραντεβού του 2025,https://www.naftemporiki.gr/sports/1872921/ta-megala-athlitika-rantevoy-toy-2025/,"2024 , , 2025 .
 , breakdance , , .
, (AI), (AR) (VR) .
 2025:
 , 2013, .
 143 (18-21 , ), .
 : , , , , , , .
 (31/05/2025)
 400 .
 2025 , 2024-25 , « » .
 FIFA (15/6-13/7)
 FIFA 21, , 32 … [+349 chars]"
MetLife to Hold Combined Earnings and Outlook Conference Call,https://www.investing.com/news/press-releases/metlife-to-hold-combined-earnings-and-outlook-conference-call-93CH-3805560,"NEW YORK--(BUSINESS WIRE)--MetLife, Inc. (NYSE: MET) today announced that it will hold a combined fourth quarter and full year 2024 earnings and outlook conference call and audio webcast on Thursday,… [+2114 chars]"
"Giants HC Brian Daboll, GM Joe Schoen are staying put after 3-14 season",https://www.foxsports.com/stories/nfl/giants-hc-brian-daboll-gm-joe-schoen-staying-put-after-3-14-season,"The New York Giants are sticking with head coach Brian Daboll and general manager Joe Schoen.
Team president and co-owner John Mara announced Monday that he and co-owner Steve Tisch decided to move … [+3966 chars]"
MetLife to acquire PineBridge Investments for $800M,https://thefly.com/permalinks/entry.php/id4043020/MET-MetLife-to-acquire-PineBridge-Investments-for-M,"Earnings calls, analyst events, roadshows and more"
MetLife (NYSE:MET) Stock Rating Lowered by StockNews.com,https://www.etfdailynews.com/2025/01/11/metlife-nysemet-stock-rating-lowered-by-stocknews-com/,"MetLife (NYSE:MET – Get Free Report) was downgraded by research analysts at StockNews.com from a “buy” rating to a “hold” rating in a research report issued to clients and investors on Thursday.
Sev… [+4125 chars]"
StockNews.com Upgrades MetLife (NYSE:MET) to “Buy”,https://www.etfdailynews.com/2025/01/01/stocknews-com-upgrades-metlife-nysemet-to-buy/,"MetLife (NYSE:MET – Get Free Report) was upgraded by stock analysts at StockNews.com from a “hold” rating to a “buy” rating in a note issued to investors on Wednesday.
A number of other research fir… [+4334 chars]"
MetLife Earnings Preview: What to Expect,https://biztoc.com/x/1384576992eed625,Market Pulse-- Options Market Overview- Unusual Options Activity- IV Rank and IV Percentile- Implied vs Realized Vol- Most Active Options- Highest Open Positions- Unusual Options Volume- Highest Impl… [+135 chars]
Can Pochettino really transform the USMNT's mentality -- and how will he do it?,https://www.espn.com/soccer/story/_/id/43371423/mentality-heart-mauricio-pochettino-usmnt-us-mens-national-team-revolution,"Jan 13, 2025, 08:00 AM ET
MIAMI -- Mauricio Pochettino has led some of the most distinguished clubs in Europe, but when he accepted the role of U.S. men's national team manager, he made the choice t… [+7164 chars]"
Saints Running Back Kendre Miller Exits Raiders Matchup With Concussion,https://www.newsweek.com/sports/nfl/saints-running-back-kendre-miller-exits-raiders-matchup-concussion-2007174,"New Orleans Saints star running back Kendre Miller has exited Week 17's matchup against the Las Vegas Raiders with a concussion. With Miller out, the Saints will be down to RBs Clyde Edwards-Helaire … [+3049 chars]"
Rex Ryan Attempting NFL Return by Interviewing for Jets HC Vacancy: Report,https://www.newsweek.com/sports/nfl/rex-ryan-attempting-nfl-return-returning-jets-head-coach-report-2009687,The New York Jets are looking for a new head coach and general manager. Some of the interviews so far have been with former Washington Commanders head coach Ron Rivera and former player and TV person… [+3111 chars]
Jets Have Passed on Rex Ryan as Head Coach: Report,https://www.newsweek.com/sports/nfl/jets-have-passed-rex-ryan-head-coach-report-2013723,"The New York Jets are looking for their next head coach after the team unceremoniously fired Robert Saleh after Week 5 of the 2024 season. With Jeff Ulbrich taking over, the team would go 5-12.
Read… [+3036 chars]"
Saints' Alvin Kamara Reveals Vote for Franchise's Next Head Coach,https://www.newsweek.com/sports/nfl/saints-alvin-kamara-reveals-vote-franchises-next-head-coach-2018529,"Many NFL teams are already hiring their next head coaches. The New England Patriots hired Mike Vrabel, and the Chicago Bears landed former Detroit Lions offensive coordinator Ben Johnson.
More news:… [+3349 chars]"
New York Giants Make Decision on Future of Brian Daboll and Joe Schoen,https://www.newsweek.com/sports/nfl/new-york-giants-make-decision-future-brian-daboll-joe-schoen-2010270,"The New York Giants ended the season with a 3-14 record, and everyone believed they would lead to the firing of either head coach Brian Daboll and general manager Joe Schoen. However, that will not b… [+2980 chars]"
Jets Head Coach Search: Full List of Candidates,https://www.newsweek.com/sports/nfl/jets-head-coach-search-full-list-candidates-2010488,"The New York Jets' search for a new head coach seemingly grows longer by the minute.
There are 12 candidates and counting that have been reported to have already interviewed or have interviews on th… [+3160 chars]"
Cowboys Shockingly Rule Out CeeDee Lamb For Rest of 2024 Season,https://www.newsweek.com/sports/nfl/cowboys-shockingly-rule-out-ceedee-lamb-rest-2024-season-2006351,The Dallas Cowboys continue to get hit with major injuries to their skill players. Star wide receiver CeeDee Lamb has shockingly been ruled out for the remainder of the 2024 season following a should… [+3005 chars]
Former Jets Coach Says Aaron Rodgers is 'Doing Everything He Can to Get Cut',https://www.newsweek.com/sports/nfl/former-jets-coach-says-aaron-rodgers-doing-everything-he-can-get-cut-2006966,"The speculation on what directions both Aaron Rodgers and the New York Jets will go following this season is multifarious, but a new spin was brought to the table on ""The Herd"" with Colin Cowherd on … [+3290 chars]"
Colts GM Will Not Guarantee Anthony Richardson as Starting Quarterback in 2025,https://www.newsweek.com/sports/nfl/colts-gm-will-not-guarantee-anthony-richardson-starting-quarterback-2025-2013156,"The Indianapolis Colts were meant to make it to the playoffs and had a route to do so towards the end of the season. However, their postseason plans were crushed when the lowly New York Giants routed… [+3028 chars]"
"WWE Champion Threatens Dwayne Johnson of ""Stealing Time"" Following Big Win",https://www.newsweek.com/sports/wrestling/wwe-champion-threatens-dwayne-johnson-stealing-time-following-big-win-2013498,"Dwayne ""The Rock"" Johnson has returned to WWE in a very big way, but it seems that some younger wrestlers are not too happy with how the Hall of Famer is eating up screen time.
More News:WWE Founder… [+2620 chars]"
49ers Signal Reunion by Interviewing Robert Saleh for Vacant DC Position,https://www.newsweek.com/sports/nfl/49ers-signal-reunion-interviewing-robert-saleh-dc-position-2012718,"The San Francisco 49ers are among many teams that are searching for a new coach. Though the team is not looking for a head coach, they need a new defensive coordinator, as they fired Nick Sorensen fr… [+2927 chars]"
Jets Reveal Significance of Injury to Olu Fashanu,https://www.newsweek.com/sports/nfl/jets-reveal-significance-injury-olu-fashanu-2005783,"New York Jets star rookie offensive lineman Olu Fashanu has been placed on the injured reserve list and will miss the last two games of the season. Per NFL insider Rich Cimini, ""Jets rookie LT Olu Fa… [+2970 chars]"
Jets' Aaron Rodgers in Danger of Missing Week 17 With Significant Injury,https://www.newsweek.com/sports/nfl/jets-aaron-rodgers-danger-missing-week-17-significant-injury-2005787,"The New York Jets could end up benching Aaron Rodgers for the final two games of the season, simply because the quarterback is dealing with a significant injury. Rodgers has popped up on the injury r… [+3025 chars]"
Colts' DeForest Buckner Takes Massive Shot at Organization Following Playoffs Miss,https://www.newsweek.com/sports/nfl/colts-deforest-buckner-takes-massive-shot-organization-following-playoffs-miss-2007651,"Another NFL season is nearly gone, and another year the Indianapolis Colts will not see the postseason. All the team had to do was to beat the lowly New York Giants on Sunday, but they fell with a fi… [+3476 chars]"
Giants' Armon Watts Carted to Locker Room Following Scary Leg Injury,https://www.newsweek.com/sports/nfl/giants-armon-watts-carted-locker-room-following-scary-leg-injury-2007171,"The New York Giants are attempting to secure a much-needed win against the Indianapolis Colts, but they will do so without the help of defensive tackle Armon Watts. Watts has suffered an apparent leg… [+2717 chars]"
Pro Football Hall of Fame Class of 2025 Finalists Announced,https://www.newsweek.com/sports/nfl/pro-football-hall-fame-class-2025-finalists-announced-2006943,"The Pro Football Hall of Fame has announced their finalist for the Modern-Era category of the class of 2025. While only five of these players will eventually be inducted this year, it is an honor for… [+3473 chars]"
Broncos' Patrick Surtain Calls Out Officiating Following Patrick Mahomes Call,https://www.newsweek.com/sports/nfl/broncos-patrick-surtain-calls-out-officiating-following-patrick-mahomes-call-2017308,"Denver Broncos cornerback Patrick Surtain is pretty fed up with the officiating in tonight's Divisional Round game between the Kansas City Chiefs and the Houston Texans.
Cmon man what we supposed to… [+3185 chars]"
"MetLife, Inc. (NYSE:MET) Stock Position Raised by Wedmont Private Capital",https://www.etfdailynews.com/2025/01/15/metlife-inc-nysemet-stock-position-raised-by-wedmont-private-capital/,"Wedmont Private Capital boosted its position in shares of MetLife, Inc. (NYSE:MET – Free Report) by 7.0% during the 4th quarter, HoldingsChannel reports. The firm owned 9,967 shares of the financial … [+5076 chars]"
"Brookstone Capital Management Has $533,000 Holdings in MetLife, Inc. (NYSE:MET)",https://www.etfdailynews.com/2025/01/18/brookstone-capital-management-has-533000-holdings-in-metlife-inc-nysemet/,"Brookstone Capital Management boosted its position in MetLife, Inc. (NYSE:MET – Free Report) by 15.8% in the fourth quarter, HoldingsChannel.com reports. The institutional investor owned 6,504 shares… [+4824 chars]"
MetLife Executive Vice President and Chief Accounting Officer Announces Resignation,https://www.etfdailynews.com/2025/01/13/metlife-executive-vice-president-and-chief-accounting-officer-announces-resignation/,"MetLife, Inc. (NYSE:MET) received a recent 8-K filing with the Securities and Exchange Commission on January 7, 2025. According to the filing, Tamara L. Schock, the Executive Vice President and Chief… [+1827 chars]"
MetLife signs deal to acquire asset manager PineBridge,https://biztoc.com/x/ffec37477ddb48ae,"In This Article:MetLife Investment Management (MIM), the institutional asset management business of US insurance giant MetLife, has agreed to acquire asset management firm PineBridge Investments from… [+146 chars]"
"Pensionfund Sabic Buys 5,000 Shares of MetLife, Inc. (NYSE:MET)",https://www.etfdailynews.com/2025/01/06/pensionfund-sabic-buys-5000-shares-of-metlife-inc-nysemet/,"Pensionfund Sabic increased its stake in shares of MetLife, Inc. (NYSE:MET – Free Report) by 32.3% during the 4th quarter, Holdings Channel reports. The fund owned 20,500 shares of the financial serv… [+4989 chars]"
